{
  "artifact_hash": "sha256:2188eb1ada3c5d86148a01b8003d6f13ef55f56a8ec010cc9f4f7bd2816330d0",
  "artifact_id": "STAGE-019f8d2d-9306-7928-beee-0e5fb3409e3b",
  "artifact_ids": [
    "REV-cfd7858c-654d-48cd-a22f-55b0aabf90b3",
    "CLM-a3d4cd26-92c8-47d7-9620-a1ac8fe6e415-v3"
  ],
  "created_at": "2026-07-23T04:13:22.053111Z",
  "created_by": {
    "actor_type": "agent",
    "host": "codex",
    "model_identifier": "gpt-5"
  },
  "notes": [
    "Citation review verified the exact supporting and contradicting locators against canonical chunk text and span hashes.",
    "Claim v3 supersedes v2 to mark citation_status passed and claim_status citation_checked while preserving the unresolved contradiction, pending independent review, and human-review requirement."
  ],
  "outcome": "completed",
  "run_id": "RUN-563cd90e-af4d-46fa-9302-f48c030cb398",
  "schema_name": "StageResponse",
  "schema_version": "1.0.0",
  "stage": "citation_review"
}
