{
  "artifact_hash": "sha256:0b74ab514b6b89c3cd5c7882f2c37afbb2de1e6b6b03e96689ed2c293a3ee802",
  "artifact_id": "STAGE-019f8d2e-69b5-7606-a81f-935891396a4f",
  "artifact_ids": [
    "REV-c4f5f372-a7d4-4334-b55d-36d3c6d99bf0",
    "CLM-a3d4cd26-92c8-47d7-9620-a1ac8fe6e415-v4"
  ],
  "created_at": "2026-07-23T04:14:17.012091Z",
  "created_by": {
    "actor_type": "agent",
    "host": "codex",
    "model_identifier": "gpt-5"
  },
  "notes": [
    "Methodology review compared the synthetic-study method and stated limitation against the independent production-trace replication.",
    "Claim v4 supersedes v3 to set methodology_quality medium and methodology_status limitations_detected while preserving conflicting_evidence, the unresolved contradiction, pending independent review, and human-review requirement."
  ],
  "outcome": "completed",
  "run_id": "RUN-563cd90e-af4d-46fa-9302-f48c030cb398",
  "schema_name": "StageResponse",
  "schema_version": "1.0.0",
  "stage": "methodology_review"
}
