{
  "artifact_hash": "sha256:0174ca092a83fa8277d476f2ba9372fe55c5a57204577305e1a3009b60e1868b",
  "artifact_id": "STAGE-019f8d1f-5c72-707d-af24-5e320e1c3c13",
  "artifact_ids": [
    "PLAN-019f8d1f-5c71-78ed-b94e-6abd3081cf61"
  ],
  "created_at": "2026-07-23T03:57:50.577382Z",
  "created_by": {
    "actor_type": "agent",
    "host": "codex",
    "model_identifier": "gpt-5"
  },
  "notes": [
    "Planning packet completed using only trusted workflow inputs, run metadata, and source snapshot metadata.",
    "Plan defines support, contradiction, scope limits, and insufficiency conditions for later stages."
  ],
  "outcome": "completed",
  "run_id": "RUN-563cd90e-af4d-46fa-9302-f48c030cb398",
  "schema_name": "StageResponse",
  "schema_version": "1.0.0",
  "stage": "planning"
}
